Sprint,Category,Task,Description,Priority,Estimate (days),Owner,Start Date,End Date,Status
Phase 2 - AI & Analytics,AI Pipeline,Real-time WebSocket Streaming for AI Analysis,"Stream AI analysis results (features, action items) to frontend in real-time via WebSocket instead of polling. Reduces perceived latency and improves UX.",High,4,,,,Todo
Phase 2 - AI & Analytics,AI Pipeline,Multi-language Transcript Support,"Add support for multilingual meeting transcripts (Vietnamese, Japanese, Korean, Chinese). Integrate language detection in transcript_parsers.py and adapt AI prompts per language.",High,5,,,,Todo
Phase 2 - AI & Analytics,AI Pipeline,Meeting Comparison & Trend Analysis,"Compare AI outputs across multiple meetings (same project/team). Track feature evolution, recurring action items, and decision patterns over time.",Medium,5,,,,Todo
Phase 2 - AI & Analytics,AI Pipeline,Smart Feature Deduplication Across Meetings,"Detect and merge duplicate/similar features extracted from different meetings using semantic similarity. Extend FeatureMatching schema.",Medium,3,,,,Todo
Phase 2 - AI & Analytics,AI Pipeline,Customizable AI Prompt Templates,"Allow users to create/save custom prompt templates for different meeting types (standup, retro, planning, design review). Store in DB per user/org.",Medium,4,,,,Todo
Phase 2 - AI & Analytics,AI Pipeline,Batch Upload & Bulk Analysis,"Support uploading multiple meeting files at once. Queue them for sequential processing with a unified progress dashboard.",Medium,3,,,,Todo
Phase 2 - AI & Analytics,Analytics,Team Analytics Dashboard,"Aggregate analytics across all meetings: total features extracted, action item completion rates, meeting frequency, cost per meeting, speaker participation trends.",High,5,,,,Todo
Phase 2 - AI & Analytics,Analytics,Action Item Tracking & Follow-up,"Track action items across meetings. Auto-detect completion status in subsequent meetings. Send email reminders for overdue items.",High,5,,,,Todo
Phase 2 - AI & Analytics,Analytics,Meeting Effectiveness Score,"Calculate a composite score per meeting based on: action items generated, decisions made, participant engagement, duration efficiency.",Medium,3,,,,Todo
Phase 2 - AI & Analytics,Analytics,Cost Analytics & Budget Controls,"Dashboard showing AI cost per meeting/user/team. Set monthly cost budgets with alerts. Extend existing cost_tracker.py.",Medium,3,,,,Todo
Phase 2 - Collaboration,Collaboration,Team Workspaces & Organizations,"Multi-tenant organization support: invite team members, shared meeting library, org-level settings, role-based access (admin/member/viewer).",High,8,,,,Todo
Phase 2 - Collaboration,Collaboration,Collaborative Transcript Editing,"Real-time collaborative editing of transcripts (like Google Docs). Multiple users can edit speaker names, fix text, and add annotations simultaneously.",Medium,6,,,,Todo
Phase 2 - Collaboration,Collaboration,Comments & Annotations on Features,"Allow team members to comment on extracted features, vote on priority, and add context. Thread-based discussions on each feature.",Medium,4,,,,Todo
Phase 2 - Collaboration,Collaboration,Share & Public Links,"Generate shareable links for analysis results (read-only). Support password protection and expiry dates.",Low,3,,,,Todo
Phase 2 - Integrations,Integration,Jira/Linear Integration,"Export extracted features directly as Jira issues or Linear tickets. Map priority, assignee, effort estimates to issue fields.",High,5,,,,Todo
Phase 2 - Integrations,Integration,Slack/Teams Notification Bot,"Send meeting summaries, action items, and feature lists to Slack/Teams channels after analysis completes.",Medium,4,,,,Todo
Phase 2 - Integrations,Integration,Google Meet/Zoom Recording Auto-Import,"Connect to Google Meet or Zoom API to auto-import meeting recordings. Trigger analysis pipeline automatically.",Medium,5,,,,Todo
Phase 2 - Integrations,Integration,Calendar Integration (Google/Outlook),"Link meetings to calendar events. Auto-tag with attendees, meeting title, and recurring meeting context.",Low,3,,,,Todo
Phase 2 - Integrations,Integration,Webhook System for External Events,"Allow users to configure webhooks triggered on: analysis complete, action item created, evaluation score below threshold.",Low,3,,,,Todo
Phase 2 - UX & Frontend,Dashboard,Meeting Library with Search & Filters,"Searchable meeting archive with filters by date, participants, meeting type, tags. Full-text search across transcripts and features.",High,4,,,,Todo
Phase 2 - UX & Frontend,Dashboard,Kanban Board for Action Items,"Drag-and-drop Kanban board to manage extracted action items (Todo → In Progress → Done). Per-meeting and cross-meeting views.",Medium,4,,,,Todo
Phase 2 - UX & Frontend,Dashboard,Feature Roadmap Visualization,"Auto-generate a visual roadmap from extracted features across meetings. Timeline view grouped by module/phase/priority.",Medium,5,,,,Todo
Phase 2 - UX & Frontend,Upload,Audio/Video Recording in Browser,"Allow users to record meetings directly in the browser. Upload recording to pipeline without external tools.",Medium,4,,,,Todo
Phase 2 - UX & Frontend,Dashboard,Dark Mode & Theme Customization,"Full dark mode support. Allow users to customize accent colors. Persist preference per user.",Low,2,,,,Todo
Phase 2 - Infrastructure,DevOps,CI/CD Pipeline with GitHub Actions,"Automated testing, linting, type-checking, and deployment on push. Separate staging/production environments.",High,3,,,,Todo
Phase 2 - Infrastructure,DevOps,Horizontal Scaling with Worker Pods,"Scale arq workers independently. Add Kubernetes manifests or Cloud Run config for auto-scaling based on queue depth.",Medium,4,,,,Todo
Phase 2 - Infrastructure,Security,Audit Log System,"Log all user actions (login, upload, edit, export, delete) with timestamps and IP. Admin-viewable audit trail.",Medium,3,,,,Todo
Phase 2 - Infrastructure,Security,SSO / OAuth2 Login (Google/Microsoft),"Add social login via Google and Microsoft OAuth2. Map to existing user accounts or auto-create.",Medium,3,,,,Todo
Phase 2 - Infrastructure,Performance,Smart Semantic Cache v2,"Improve existing semantic cache with vector similarity search. Cache at chunk level instead of full transcript. Reduce repeat analysis costs by ~60%.",Medium,4,,,,Todo
Phase 2 - AI & Analytics,AI Pipeline,Meeting Minutes PDF Report,"Auto-generate professional PDF meeting minutes with branding: summary, features table, action items, speaker stats. Download or email.",Medium,3,,,,Todo
Phase 2 - AI & Analytics,AI Pipeline,Sentiment Analysis per Speaker,"Analyze sentiment trends per speaker throughout the meeting. Visualize positive/negative/neutral shifts on a timeline.",Low,3,,,,Todo
Phase 2 - AI & Analytics,AI Pipeline,Risk & Dependency Detection,"AI identifies risks, blockers, and dependencies mentioned in meetings. Link to specific features and action items.",Medium,3,,,,Todo
Phase 2 - AI & Analytics,Evaluation,A/B Prompt Testing Framework,"Run two prompt versions on the same transcript simultaneously. Compare extraction quality via evaluation metrics. Auto-select winner.",Medium,4,,,,Todo
Phase 2 - UX & Frontend,Dashboard,Notification Center,"In-app notification center: analysis complete, action item reminders, team mentions, evaluation alerts.",Low,3,,,,Todo
